--- Command used ---
prepDyn(input_file='../test_data/simulations_v1/2_aligned', input_format='fasta', MSA=False, output_file='../test_data/simulations_v1/3.8_elPartition64/3.8', output_format='fasta', log=True, sequence_names=True, orphan_threshold=10, percentile=25, del_inv=False, internal_leaves='all', partitioning_method='equal', partitioning_round=64)

--- Step 1: Summary before preprocessing ---
No. sequences: 80
No. columns: 100
Total no. nucleotides (A/C/G/T only): 7916 bp
Total no. gaps (-): 84
Total no. IUPAC N: 0

--- Step 3: Missing data identification (gaps replaced with '?') ---
Total '?' characters: 0
Total '-' characters in fully missing partitions: 83
Combined total: 83

L08: partition 37 (74–74, length 1) fully missing (all '-')
L09: partition 37 (74–74, length 1) fully missing (all '-')
L10: partition 37 (74–74, length 1) fully missing (all '-')
L11: partition 37 (74–74, length 1) fully missing (all '-')
L12: partition 37 (74–74, length 1) fully missing (all '-')
L13: partition 37 (74–74, length 1) fully missing (all '-')
L14: partition 37 (74–74, length 1) fully missing (all '-')
L15: partition 37 (74–74, length 1) fully missing (all '-')
L16: partition 37 (74–74, length 1) fully missing (all '-')
L17: partition 37 (74–74, length 1) fully missing (all '-')
L18: partition 37 (74–74, length 1) fully missing (all '-')
L19: partition 37 (74–74, length 1) fully missing (all '-')
L20: partition 37 (74–74, length 1) fully missing (all '-')
L21: partition 37 (74–74, length 1) fully missing (all '-')
L22: partition 37 (74–74, length 1) fully missing (all '-')
L23: partition 37 (74–74, length 1) fully missing (all '-')
L24: partition 37 (74–74, length 1) fully missing (all '-')
L25: partition 37 (74–74, length 1) fully missing (all '-')
L26: partition 37 (74–74, length 1) fully missing (all '-')
L27: partition 37 (74–74, length 1) fully missing (all '-')
L28: partition 37 (74–74, length 1) fully missing (all '-')
L29: partition 37 (74–74, length 1) fully missing (all '-')
L30: partition 37 (74–74, length 1) fully missing (all '-')
L31: partition 37 (74–74, length 1) fully missing (all '-')
L31: partition 38 (76–76, length 1) fully missing (all '-')
L32: partition 37 (74–74, length 1) fully missing (all '-')
L32: partition 38 (76–76, length 1) fully missing (all '-')
L33: partition 37 (74–74, length 1) fully missing (all '-')
L33: partition 38 (76–76, length 1) fully missing (all '-')
L33: partition 63 (126–126, length 1) fully missing (all '-')
L34: partition 37 (74–74, length 1) fully missing (all '-')
L35: partition 37 (74–74, length 1) fully missing (all '-')
L36: partition 37 (74–74, length 1) fully missing (all '-')
L37: partition 37 (74–74, length 1) fully missing (all '-')
L38: partition 37 (74–74, length 1) fully missing (all '-')
L39: partition 37 (74–74, length 1) fully missing (all '-')
L40: partition 37 (74–74, length 1) fully missing (all '-')
L41: partition 37 (74–74, length 1) fully missing (all '-')
L42: partition 37 (74–74, length 1) fully missing (all '-')
L43: partition 37 (74–74, length 1) fully missing (all '-')
L44: partition 37 (74–74, length 1) fully missing (all '-')
L45: partition 26 (52–52, length 1) fully missing (all '-')
L45: partition 27 (54–54, length 1) fully missing (all '-')
L45: partition 28 (56–56, length 1) fully missing (all '-')
L45: partition 37 (74–74, length 1) fully missing (all '-')
L46: partition 26 (52–52, length 1) fully missing (all '-')
L46: partition 27 (54–54, length 1) fully missing (all '-')
L46: partition 28 (56–56, length 1) fully missing (all '-')
L46: partition 37 (74–74, length 1) fully missing (all '-')
L47: partition 37 (74–74, length 1) fully missing (all '-')
L48: partition 37 (74–74, length 1) fully missing (all '-')
L49: partition 37 (74–74, length 1) fully missing (all '-')
L50: partition 37 (74–74, length 1) fully missing (all '-')
L51: partition 37 (74–74, length 1) fully missing (all '-')
L52: partition 37 (74–74, length 1) fully missing (all '-')
L53: partition 37 (74–74, length 1) fully missing (all '-')
L54: partition 37 (74–74, length 1) fully missing (all '-')
L55: partition 37 (74–74, length 1) fully missing (all '-')
L56: partition 37 (74–74, length 1) fully missing (all '-')
L57: partition 37 (74–74, length 1) fully missing (all '-')
L58: partition 37 (74–74, length 1) fully missing (all '-')
L59: partition 37 (74–74, length 1) fully missing (all '-')
L60: partition 37 (74–74, length 1) fully missing (all '-')
L61: partition 37 (74–74, length 1) fully missing (all '-')
L62: partition 37 (74–74, length 1) fully missing (all '-')
L63: partition 37 (74–74, length 1) fully missing (all '-')
L64: partition 37 (74–74, length 1) fully missing (all '-')
L65: partition 37 (74–74, length 1) fully missing (all '-')
L66: partition 37 (74–74, length 1) fully missing (all '-')
L67: partition 37 (74–74, length 1) fully missing (all '-')
L68: partition 37 (74–74, length 1) fully missing (all '-')
L69: partition 37 (74–74, length 1) fully missing (all '-')
L70: partition 37 (74–74, length 1) fully missing (all '-')
L71: partition 37 (74–74, length 1) fully missing (all '-')
L72: partition 37 (74–74, length 1) fully missing (all '-')
L73: partition 37 (74–74, length 1) fully missing (all '-')
L74: partition 37 (74–74, length 1) fully missing (all '-')
L75: partition 37 (74–74, length 1) fully missing (all '-')
L76: partition 37 (74–74, length 1) fully missing (all '-')
L77: partition 37 (74–74, length 1) fully missing (all '-')
L78: partition 37 (74–74, length 1) fully missing (all '-')
L79: partition 37 (74–74, length 1) fully missing (all '-')
L80: partition 37 (74–74, length 1) fully missing (all '-')

--- Step 4: Partitioning ---
Method used: equal
Columns with '#' inserted: [1, 3, 5, 7, 9, 11, 13, 15, 17, 19, 21, 23, 25, 27, 29, 31, 33, 35, 37, 39, 41, 43, 45, 47, 49, 51, 53, 55, 57, 59, 61, 63, 65, 67, 69, 71, 73, 75, 77, 79, 81, 83, 85, 87, 89, 91, 93, 95, 97, 99, 101, 103, 105, 107, 109, 111, 113, 115, 117, 119, 121, 123, 125, 127]

--- Summary after preprocessing ---
No. sequences: 80
No. columns: 164
No. pound sign columns (#): 64
Total no. nucleotides (A/C/G/T): 7916 bp
Total no. gaps (-): 84
Total no. IUPAC N: 0
Total no. missing values (?): 83

--- Run time ---
Wall-clock time: 0.03411317 seconds
CPU time: 0.03323700 seconds
